{
  "$schema": "./sync-manifest-schema.json",
  "description": "File categorization for pai-config → kai sync. This manifest defines which files are private (pai-config only), kai-only (protected), or public (synced).",
  "version": "1.0.0",
  "private": [
    "CLAUDE.md",
    "VERSION",
    "config/identity.jsonc",
    ".github/workflows/test.yml",
    "docs/planning/",
    "hooks/archive/",
    "MEMORY/KNOWLEDGE/",
    "MEMORY/STAGING/.staging-state.json",
    "MEMORY/STAGING/2026-*",
    "MEMORY/WISDOM/FRAMES/",
    "PAI/AISTEERINGRULES-EXAMPLES.md",
    "PAI/Tools/bump-version.ts",
    "Plans/",
    "skills/PAIUpgrade/",
    "policy-limits.json",
    "teams/",
    "scripts/sync-to-kai.sh",
    "scripts/verify-release.sh",
    "scripts/kai-release-audit.ts",
    "scripts/board-config.json",
    "scripts/MAINTENANCE.md",
    "docs/RELEASE-CHECKLIST.md",
    "scripts/README.md",
    "TOOLS.md",
    "TOOLS-FULL.md",
    "CAPABILITIES.md",
    "MEMORY/CAPABILITIES/",
    "projects/",
    "USER/",
    ".claude/",
    "History/",
    "specs/",
    "docs/v46-staging/",
    "docs/VERSIONING.md"
  ],
  "kai_only": [
    ".github/workflows/test.yml",
    "CHANGELOG.md",
    "CONTRIBUTING.md",
    "LICENSE",
    "LICENSE-UPSTREAM",
    "config/domains.jsonc",
    "config/identity.jsonc.template",
    "config/user-hooks.jsonc.example",
    "docs/CUSTOMIZATION.md",
    "docs/architecture/archive/",
    "docs/planning/deliberate-research-mode.md",
    "get-kai.sh",
    "PAI/CONTEXT_ROUTING.md",
    "README.md",
    "docs/WHATS-DIFFERENT.md",
    "hooks/user/",
    "MEMORY/KNOWLEDGE/.gitkeep",
    "MEMORY/LEARNING/.gitkeep",
    "MEMORY/RELATIONSHIP/.gitkeep",
    "MEMORY/SECURITY/.gitkeep",
    "MEMORY/STAGING/.gitkeep",
    "MEMORY/STATE/.gitkeep",
    "MEMORY/WORK/.gitkeep",
    "MEMORY/LEARNING/",
    "MEMORY/RELATIONSHIP/",
    "MEMORY/SECURITY/",
    "MEMORY/STATE/",
    "MEMORY/WORK/",
    "tests/ConfigLoader.test.ts",
    "tests/Installer.test.ts",
    "tests/OncePerSession.test.ts"
  ],
  "public": [
    "hooks/*.hook.ts",
    "skills/",
    "agents/",
    "PAI/Algorithm/",
    "PAI/Tools/BuildManifest.ts",
    "PAI/Tools/BuildDocs.ts",
    "scripts/release.sh",
    "scripts/hooks/pre-commit",
    "scripts/hooks/pre-push",
    "scripts/install-hooks.sh",
    "tests/*integration*.ts",
    "manifest.json",
    "docs/QUICKSTART.md",
    ".env.example",
    ".gitignore",
    "bun.lockb",
    "config/",
    "PAI/",
    "tests/"
  ],
  "notes": {
    "private": "Files excluded from sync — personal data, maintainer tooling, PII-containing patterns",
    "kai_only": "Files that exist only in kai — protected from rsync --delete during sync",
    "public": "Files that will be synced to kai — must be PII-free and ready for public consumption"
  }
}
